{"$schema":"https://json-schema.org/draft/2020-12/schema","$id":"provan.session12_implementation_binding.v1","type":"object","required":["schema_id","implementation_commit","implementation_tree","package_version","extension_api_major","wheel_sha256","schema_registry_digest","claim_registry_digest","standard_maturity","deep_maturity","published","execution_available","challenge_available"],"properties":{"schema_id":{"const":"provan.session12_implementation_binding.v1"},"implementation_commit":{"pattern":"^[0-9a-f]{40}$"},"implementation_tree":{"pattern":"^[0-9a-f]{40}$"},"package_version":{"const":"0.5.0"},"extension_api_major":{"const":1},"wheel_sha256":{"pattern":"^sha256:[0-9a-f]{64}$"},"schema_registry_digest":{"pattern":"^sha256:[0-9a-f]{64}$"},"claim_registry_digest":{"pattern":"^sha256:[0-9a-f]{64}$"},"standard_maturity":{"enum":["IMPLEMENTED_UNQUALIFIED","QUALIFIED_BOUNDED","DEGRADED","UNAVAILABLE"]},"deep_maturity":{"enum":["IMPLEMENTED_UNQUALIFIED","QUALIFIED_BOUNDED","DEGRADED","UNAVAILABLE"]},"published":{"const":false},"execution_available":{"const":false},"challenge_available":{"const":false}},"additionalProperties":false}
