{"challenge_available":false,"claim_registry_digest":"sha256:7f620ac12f7b6a432a6ac99fc206bfc47bbbbd6bfad9797ddb3648888ab8a1b5","deep_maturity":"DEGRADED","execution_available":false,"extension_api_major":1,"implementation_commit":"7c5580df5e5c9e6632889bc7709f1b52fe04c6e7","implementation_tree":"21b8ee1fc162603efac2e9b65ea0a5267c91fb05","package_version":"0.5.0","published":false,"schema_id":"provan.session12_implementation_binding.v1","schema_registry_digest":"sha256:36bfded069afc8950e4969f4daa4b03cc6d1198cf04984684f4d8e8625a971c0","standard_maturity":"QUALIFIED_BOUNDED","wheel_sha256":"sha256:85ddf1e3c5fc9362565395c9a341bc418d58884797531c0918c94befc4caaf30"}
